{
  "schema_version": "1.0",
  "meter": {
    "pos": [
      0.0,
      2.5,
      0.0
    ],
    "wall_id": "side",
    "plus_minus_ft": 0.295276
  },
  "walls": [
    {
      "id": "side",
      "baseline": [
        [
          -1.5,
          0.0
        ],
        [
          10.0,
          0.0
        ]
      ],
      "height_ft": 9.0,
      "plus_minus_ft": 0.295276
    }
  ],
  "objects": [
    {
      "type": "gas_meter",
      "wall_id": "side",
      "span_ft": [
        3.0,
        4.0
      ],
      "bottom_ft": 1.0,
      "top_ft": 3.0,
      "source": "tap",
      "conf": 0.9,
      "plus_minus_ft": 0.295276
    },
    {
      "type": "vent",
      "wall_id": "side",
      "span_ft": [
        5.249344,
        5.905512
      ],
      "bottom_ft": 1.64042,
      "top_ft": 6.56168,
      "source": "tap",
      "conf": 0.9,
      "plus_minus_ft": 0.164042
    }
  ],
  "ground": [
    {
      "type": "mulch",
      "polygon": [
        [
          -1.5,
          0.0
        ],
        [
          10.0,
          0.0
        ],
        [
          10.0,
          3.0
        ],
        [
          -1.5,
          3.0
        ]
      ]
    },
    {
      "type": "lawn",
      "polygon": [
        [
          -1.5,
          3.0
        ],
        [
          10.0,
          3.0
        ],
        [
          10.0,
          13.0
        ],
        [
          -1.5,
          13.0
        ]
      ]
    }
  ],
  "facing": [
    {
      "wall_id": "side",
      "span_ft": [
        -1.5,
        10.0
      ],
      "depth_ft": 13.0,
      "plus_minus_ft": 0.295276
    }
  ],
  "coverage": {
    "ends": {
      "left": {
        "kind": "limit",
        "note": "fence at the left property line"
      },
      "right": {
        "kind": "unexplored",
        "note": "wall continues right, not walked"
      }
    },
    "observed": [
      {
        "band": "wall",
        "span_ft": [
          -1.5,
          10.0
        ],
        "out_ft": 6.56168
      },
      {
        "band": "ground",
        "span_ft": [
          -1.5,
          3.0
        ],
        "out_ft": 13.0
      },
      {
        "band": "ground",
        "span_ft": [
          8.5,
          10.0
        ],
        "out_ft": 13.0
      },
      {
        "band": "overhead",
        "span_ft": [
          -1.5,
          10.0
        ],
        "out_ft": 9.0
      },
      {
        "band": "facing",
        "span_ft": [
          -1.5,
          10.0
        ],
        "out_ft": 13.0
      }
    ]
  }
}
